#
# Test basic FULLTEXT search functionality
#
# Create database and use it
CREATE DATABASE IF NOT EXISTS test_kvt_fts;
USE test_kvt_fts;
#
# Test 1: Basic FULLTEXT index creation and search
#
CREATE TABLE articles (
id INT PRIMARY KEY AUTO_INCREMENT,
title VARCHAR(200),
body TEXT,
FULLTEXT(title, body)
) ENGINE=KVT;
# Insert test data
INSERT INTO articles (title, body) VALUES
('MySQL Tutorial', 'DBMS stands for Database Management System'),
('How To Use MySQL', 'After you went through a lot of tutorials'),
('Optimizing MySQL', 'In this tutorial we will show you how to optimize'),
('MySQL vs MariaDB', 'MariaDB is a fork of MySQL database'),
('MySQL Security', 'Security is important when dealing with databases');
# Natural language search
SELECT id, title FROM articles 
WHERE MATCH(title, body) AGAINST('tutorial');
id	title
1	MySQL Tutorial
2	How To Use MySQL
3	Optimizing MySQL
SELECT id, title FROM articles
WHERE MATCH(title, body) AGAINST('MySQL database');
id	title
4	MySQL vs MariaDB
1	MySQL Tutorial
# With relevance score
SELECT id, title, MATCH(title, body) AGAINST('MySQL') AS score
FROM articles
WHERE MATCH(title, body) AGAINST('MySQL')
ORDER BY score DESC;
id	title	score
1	MySQL Tutorial	0.5
2	How To Use MySQL	0.5
3	Optimizing MySQL	0.5
4	MySQL vs MariaDB	0.7
5	MySQL Security	0.5
DROP TABLE articles;
#
# Test 2: Boolean mode search
#
CREATE TABLE posts (
id INT PRIMARY KEY,
content TEXT,
FULLTEXT(content)
) ENGINE=KVT;
INSERT INTO posts VALUES
(1, 'MySQL is a popular database system'),
(2, 'MariaDB is based on MySQL code'),
(3, 'PostgreSQL is another database system'),
(4, 'MySQL and MariaDB share common features'),
(5, 'Database optimization is important');
# Boolean mode: must have MySQL
SELECT id FROM posts
WHERE MATCH(content) AGAINST('+MySQL' IN BOOLEAN MODE);
id
1
2
4
# Boolean mode: must have database, must not have PostgreSQL
SELECT id FROM posts
WHERE MATCH(content) AGAINST('+database -PostgreSQL' IN BOOLEAN MODE);
id
1
5
# Boolean mode: MySQL or MariaDB
SELECT id FROM posts
WHERE MATCH(content) AGAINST('MySQL MariaDB' IN BOOLEAN MODE);
id
1
2
4
DROP TABLE posts;
#
# Test 3: Single column FULLTEXT
#
CREATE TABLE documents (
doc_id INT PRIMARY KEY,
doc_text TEXT,
FULLTEXT idx_text (doc_text)
) ENGINE=KVT;
INSERT INTO documents VALUES
(1, 'The quick brown fox jumps over the lazy dog'),
(2, 'A quick brown fox is faster than a slow turtle'),
(3, 'The lazy dog sleeps all day long'),
(4, 'Foxes are clever animals'),
(5, 'Dogs are loyal companions');
SELECT doc_id FROM documents
WHERE MATCH(doc_text) AGAINST('fox');
doc_id
1
2
4
SELECT doc_id FROM documents
WHERE MATCH(doc_text) AGAINST('quick brown');
doc_id
1
2
DROP TABLE documents;
#
# Test 4: Multiple FULLTEXT indexes
#
CREATE TABLE products (
id INT PRIMARY KEY,
name VARCHAR(100),
description TEXT,
tags VARCHAR(200),
FULLTEXT idx_name (name),
FULLTEXT idx_desc (description),
FULLTEXT idx_combined (name, description)
) ENGINE=KVT;
INSERT INTO products VALUES
(1, 'MySQL Book', 'Complete guide to MySQL database', 'database, mysql, book'),
(2, 'PHP Tutorial', 'Learn PHP programming with MySQL', 'php, programming, mysql'),
(3, 'Database Design', 'Best practices for database design', 'database, design, theory');
# Search in name only
SELECT id, name FROM products
WHERE MATCH(name) AGAINST('MySQL');
id	name
1	MySQL Book
# Search in description only
SELECT id, name FROM products
WHERE MATCH(description) AGAINST('database');
id	name
1	MySQL Book
3	Database Design
# Search in combined index
SELECT id, name FROM products
WHERE MATCH(name, description) AGAINST('MySQL database');
id	name
1	MySQL Book
3	Database Design
2	PHP Tutorial
DROP TABLE products;
#
# Test 5: Updates and deletes with FULLTEXT
#
CREATE TABLE messages (
msg_id INT PRIMARY KEY,
msg_text TEXT,
FULLTEXT(msg_text)
) ENGINE=KVT;
INSERT INTO messages VALUES
(1, 'Hello world from MySQL'),
(2, 'MariaDB is great'),
(3, 'Testing fulltext search');
# Initial search
SELECT msg_id FROM messages
WHERE MATCH(msg_text) AGAINST('MySQL');
msg_id
1
# Update a record
UPDATE messages SET msg_text = 'Hello world from MariaDB'
WHERE msg_id = 1;
# Search after update
SELECT msg_id FROM messages
WHERE MATCH(msg_text) AGAINST('MySQL');
msg_id
SELECT msg_id FROM messages
WHERE MATCH(msg_text) AGAINST('MariaDB');
msg_id
1
2
# Delete a record
DELETE FROM messages WHERE msg_id = 2;
# Search after delete
SELECT msg_id FROM messages
WHERE MATCH(msg_text) AGAINST('MariaDB');
msg_id
1
DROP TABLE messages;
#
# Test 6: NULL values in FULLTEXT columns
#
CREATE TABLE nullable_text (
id INT PRIMARY KEY,
text_col TEXT,
FULLTEXT(text_col)
) ENGINE=KVT;
INSERT INTO nullable_text VALUES
(1, 'Some text content'),
(2, NULL),
(3, 'More text content'),
(4, '');
SELECT id FROM nullable_text
WHERE MATCH(text_col) AGAINST('text');
id
1
3
DROP TABLE nullable_text;
# Cleanup
DROP DATABASE test_kvt_fts;